{
  "registry": 1,
  "name": "learncroc builtin",
  "updated": "2026-10-20T09:23:58Z",
  "packs": [
    {
      "id": "climate-science",
      "title": "Climate science",
      "subtitle": "Read the planet's thermostat, from first principles",
      "tagline": "CO₂ is 0.04% of the air. Build the thermostat and see why it matters.",
      "publisher": "learncroc",
      "tier": "official",
      "category": "science",
      "tags": [
        "climate",
        "greenhouse effect",
        "carbon cycle",
        "keeling curve",
        "energy balance",
        "earth science"
      ],
      "lang": "en",
      "profile": "sampler",
      "review": "draft",
      "customInteractives": true,
      "theme": {
        "renderer": "metro",
        "world": "The Ice Core",
        "mode": "light",
        "ground": "#EEF4F8",
        "texture": "ice",
        "lines": [
          "#2A5E9E",
          "#6B47A6",
          "#2D7542",
          "#94407F",
          "#4A5A6E"
        ],
        "token": "lantern"
      },
      "outcomes": [
        "Explain why a planet settles at the temperature it does, and what shifts it",
        "Explain how 0.04% of the air can warm the whole planet",
        "Read the Keeling Curve and answer \"it snowed today\" with evidence"
      ],
      "sketch": {
        "width": 672,
        "height": 896,
        "nodes": [
          {
            "id": "energy-balance",
            "x": 84,
            "y": 840,
            "line": "energy",
            "kind": "node",
            "status": "playable"
          },
          {
            "id": "carbon-cycle",
            "x": 252,
            "y": 840,
            "line": "carbon",
            "kind": "node",
            "status": "playable"
          },
          {
            "id": "weather-vs-climate",
            "x": 420,
            "y": 840,
            "line": "evidence",
            "kind": "node",
            "status": "playable"
          },
          {
            "id": "greenhouse",
            "x": 84,
            "y": 728,
            "line": "energy",
            "kind": "node",
            "status": "playable"
          },
          {
            "id": "keeling",
            "x": 252,
            "y": 728,
            "line": "carbon",
            "kind": "node",
            "status": "playable"
          },
          {
            "id": "boss-dinner-debate",
            "x": 84,
            "y": 616,
            "line": "energy",
            "kind": "checkpoint",
            "status": "playable"
          },
          {
            "id": "molecules",
            "x": 84,
            "y": 504,
            "line": "energy",
            "kind": "node",
            "status": "planned"
          },
          {
            "id": "fingerprints",
            "x": 84,
            "y": 392,
            "line": "evidence",
            "kind": "node",
            "status": "planned"
          },
          {
            "id": "ice-cores",
            "x": 252,
            "y": 504,
            "line": "evidence",
            "kind": "node",
            "status": "planned"
          },
          {
            "id": "ocean",
            "x": 420,
            "y": 504,
            "line": "carbon",
            "kind": "node",
            "status": "planned"
          },
          {
            "id": "feedbacks",
            "x": 588,
            "y": 504,
            "line": "next",
            "kind": "node",
            "status": "planned"
          },
          {
            "id": "sensitivity",
            "x": 588,
            "y": 392,
            "line": "next",
            "kind": "node",
            "status": "planned"
          },
          {
            "id": "ice-sea-level",
            "x": 420,
            "y": 392,
            "line": "next",
            "kind": "node",
            "status": "planned"
          },
          {
            "id": "carbon-budget",
            "x": 588,
            "y": 280,
            "line": "action",
            "kind": "node",
            "status": "planned"
          },
          {
            "id": "solutions",
            "x": 588,
            "y": 168,
            "line": "action",
            "kind": "node",
            "status": "planned"
          },
          {
            "id": "boss-planet-2100",
            "x": 420,
            "y": 56,
            "line": "next",
            "kind": "checkpoint",
            "status": "planned"
          }
        ],
        "edges": [
          {
            "from": "energy-balance",
            "to": "greenhouse",
            "kind": "line"
          },
          {
            "from": "carbon-cycle",
            "to": "keeling",
            "kind": "line"
          },
          {
            "from": "greenhouse",
            "to": "boss-dinner-debate",
            "kind": "line"
          },
          {
            "from": "keeling",
            "to": "boss-dinner-debate",
            "kind": "interchange"
          },
          {
            "from": "weather-vs-climate",
            "to": "boss-dinner-debate",
            "kind": "transfer"
          },
          {
            "from": "boss-dinner-debate",
            "to": "molecules",
            "kind": "line"
          },
          {
            "from": "molecules",
            "to": "fingerprints",
            "kind": "interchange"
          },
          {
            "from": "boss-dinner-debate",
            "to": "ice-cores",
            "kind": "interchange"
          },
          {
            "from": "boss-dinner-debate",
            "to": "ocean",
            "kind": "interchange"
          },
          {
            "from": "boss-dinner-debate",
            "to": "feedbacks",
            "kind": "transfer"
          },
          {
            "from": "feedbacks",
            "to": "sensitivity",
            "kind": "line"
          },
          {
            "from": "ocean",
            "to": "ice-sea-level",
            "kind": "interchange"
          },
          {
            "from": "sensitivity",
            "to": "carbon-budget",
            "kind": "interchange"
          },
          {
            "from": "carbon-budget",
            "to": "solutions",
            "kind": "line"
          },
          {
            "from": "carbon-budget",
            "to": "boss-planet-2100",
            "kind": "interchange"
          },
          {
            "from": "feedbacks",
            "to": "boss-planet-2100",
            "kind": "line"
          },
          {
            "from": "ice-sea-level",
            "to": "boss-planet-2100",
            "kind": "line"
          },
          {
            "from": "solutions",
            "to": "boss-planet-2100",
            "kind": "interchange"
          }
        ],
        "lines": [
          {
            "id": "energy",
            "color": 1
          },
          {
            "id": "carbon",
            "color": 2
          },
          {
            "id": "evidence",
            "color": 3
          },
          {
            "id": "next",
            "color": 4
          },
          {
            "id": "action",
            "color": 5
          }
        ]
      },
      "latest": "0.1.0",
      "versions": [
        {
          "version": "0.1.0",
          "engine": ">=0.1.0 <1.0.0",
          "url": "dist/climate-science-0.1.0.lmpack",
          "sha256": "437ac0429e35fc40d1fb6c360da04b3be1ab6b5b61f64693eeac60b2577dd4e8",
          "size": 32319,
          "nodes": 16,
          "playable": 6,
          "estMinutes": 30,
          "license": "CC-BY-SA-4.0",
          "published": "2026-10-20T09:23:46Z",
          "tryUrl": "dist/climate-science-0.1.0.try.json"
        }
      ]
    },
    {
      "id": "color-theory",
      "title": "Color theory",
      "subtitle": "See like a painter, and like a screen",
      "tagline": "Two identical greys look different. Learn why color lies, and how to make it sing.",
      "publisher": "learncroc",
      "tier": "official",
      "category": "arts",
      "tags": [
        "color",
        "colour",
        "design",
        "painting",
        "perception",
        "hsl",
        "rgb"
      ],
      "lang": "en",
      "profile": "sampler",
      "review": "draft",
      "customInteractives": true,
      "theme": {
        "renderer": "sketchbook",
        "world": "The Prism Studio",
        "mode": "light",
        "ground": "#F7F3EA",
        "texture": "watercolour",
        "lines": [
          "#2F5DA8",
          "#8A3FA0",
          "#B0306A",
          "#4F7A1E",
          "#6B4E2E"
        ],
        "token": "paper-plane"
      },
      "outcomes": [
        "Describe any color with hue, saturation and lightness, and change one without the others",
        "Predict what mixing lights or inks will make, and pick a color's complement",
        "Use value and simultaneous contrast to make a design read, and spot when your eyes are fooled"
      ],
      "sketch": {
        "width": 1008,
        "height": 560,
        "nodes": [
          {
            "id": "contrast-illusions",
            "x": 84,
            "y": 56,
            "line": "seeing",
            "kind": "node",
            "status": "playable"
          },
          {
            "id": "hsl",
            "x": 84,
            "y": 168,
            "line": "dials",
            "kind": "node",
            "status": "playable"
          },
          {
            "id": "light-vs-paint",
            "x": 84,
            "y": 280,
            "line": "mixing",
            "kind": "node",
            "status": "playable"
          },
          {
            "id": "value",
            "x": 252,
            "y": 56,
            "line": "seeing",
            "kind": "node",
            "status": "playable"
          },
          {
            "id": "wheel",
            "x": 252,
            "y": 280,
            "line": "mixing",
            "kind": "node",
            "status": "playable"
          },